{"version":1,"layer":"aoa-kag","artifact_identity":{"artifact_class":"derived_kag_registry_readmodel_bundle","surface_state":"public_generated_kag_registry","owner_repo":"aoa-kag","authority_ref":"docs/KAG_MODEL.md","producer":"scripts/generate_kag.py from manifests/kag_registry.json","consumer_expectation":"consumers verify artifact_identity, version, layer, schema conformance, generated parity, validate_kag, and OS Abyss ABI/SBOM-lite/SLSA sidecars before using the registry as a derived KAG surface catalog","privacy_boundary":"public derived refs and compact summaries only; no private session, memo payload body, source corpus body, secrets, live runtime state, or local host evidence","content_identity":"generated/kag_registry.json and generated/kag_registry.min.json rebuilt from manifests/kag_registry.json and compared by validate_kag","abi_epoch":"aoa_kag_registry_readmodel_v1","contract_version":"schemas/kag-registry.schema.json@aoa_kag_registry_readmodel_v1#artifact_identity","trust_layer":["abi_contract_signature","sbom","slsa_in_toto"],"verification":["python scripts/validate_kag.py","python scripts/ci_gate.py --mode generated","python scripts/validate_abyss_machine_kag_registry_bundle.py"],"action":"ADD_RELEASE_PROVENANCE"},"surfaces":[{"id":"AOA-K-0001","name":"technique-section-lift","status":"active","summary":"Lifts stable source sections into bounded KAG-friendly section units without replacing authored markdown meaning.","source_class":"technique_bundle","derived_kind":"section_manifest","provenance_mode":"strict_source_linked","normalization_scope":"bounded_sections","framework_readiness":"neutral","source_repos":["aoa-techniques"]},{"id":"AOA-K-0002","name":"metadata-spine-projection","status":"active","summary":"Projects bounded source metadata into a KAG-friendly identity and routing spine without replacing source meaning.","source_class":"technique_bundle","derived_kind":"metadata_spine","provenance_mode":"strict_source_linked","normalization_scope":"bundle_identity","framework_readiness":"neutral","source_repos":["aoa-techniques"]},{"id":"AOA-K-0003","name":"bounded-relation-view","status":"active","summary":"Lifts direct typed relations into bounded edge hints without implying full graph semantics.","source_class":"technique_bundle","derived_kind":"relation_view","provenance_mode":"bounded_source_linked","normalization_scope":"direct_edges","framework_readiness":"neutral","source_repos":["aoa-techniques"]},{"id":"AOA-K-0004","name":"provenance-note-view","status":"active","summary":"Lifts provenance-oriented note handles into bounded KAG surfaces that preserve source linkage.","source_class":"review_surface","derived_kind":"provenance_view","provenance_mode":"derived_with_handles","normalization_scope":"provenance_handles","framework_readiness":"neutral","source_repos":["aoa-techniques"]},{"id":"AOA-K-0005","name":"tos-text-chunk-map","status":"experimental","summary":"Maps authored ToS texts into bounded chunk-level retrieval units with explicit source linkage.","source_class":"tos_text","derived_kind":"chunk_map","provenance_mode":"strict_source_linked","normalization_scope":"text_chunks","framework_readiness":"llamaindex_ready","source_repos":["Tree-of-Sophia"]},{"id":"AOA-K-0006","name":"cross-source-node-projection","status":"experimental","summary":"Creates a bounded one-hop cross-source node projection from source-owned exports while preserving explicit primary versus supporting provenance.","source_class":"technique_bundle","source_inputs":[{"repo":"aoa-techniques","source_class":"technique_bundle","role":"primary"},{"repo":"Tree-of-Sophia","source_class":"tos_text","role":"supporting"}],"derived_kind":"node_projection","provenance_mode":"derived_with_handles","normalization_scope":"cross_source_nodes","framework_readiness":"multi_consumer_ready","source_repos":["aoa-techniques","Tree-of-Sophia"]},{"id":"AOA-K-0007","name":"tos-retrieval-axis-surface","status":"experimental","summary":"Returns bounded lineage, conflict, practice, and source handles for one ToS chunk set as a bridge-ready retrieval surface for AoA consumers.","source_class":"tos_text","source_inputs":[{"repo":"Tree-of-Sophia","source_class":"tos_text","role":"primary"},{"repo":"aoa-memo","source_class":"memo_object","role":"supporting"}],"derived_kind":"retrieval_surface","provenance_mode":"derived_with_handles","normalization_scope":"axis_bundles","framework_readiness":"hipporag_ready","source_repos":["Tree-of-Sophia","aoa-memo"]},{"id":"AOA-K-0008","name":"counterpart-edge-view","status":"planned","summary":"Projects bounded non-identity counterpart edges from ToS concepts into selected AoA operational surfaces without granting graph sovereignty.","source_class":"tos_text","source_inputs":[{"repo":"Tree-of-Sophia","source_class":"tos_text","role":"primary"},{"repo":"aoa-techniques","source_class":"technique_bundle","role":"supporting"},{"repo":"aoa-playbooks","source_class":"playbook_bundle","role":"supporting"},{"repo":"aoa-evals","source_class":"eval_bundle","role":"supporting"}],"derived_kind":"edge_projection","provenance_mode":"derived_with_handles","normalization_scope":"counterpart_edges","framework_readiness":"neutral","source_repos":["Tree-of-Sophia","aoa-techniques","aoa-playbooks","aoa-evals"]},{"id":"AOA-K-0009","name":"federation-readiness-spine","status":"experimental","summary":"Materializes a bounded federation entry spine from current source-owned tiny KAG exports in aoa-techniques and Tree-of-Sophia without claiming a wider completed federation.","source_class":"review_surface","source_inputs":[{"repo":"aoa-techniques","source_class":"review_surface","role":"primary"},{"repo":"Tree-of-Sophia","source_class":"tos_text","role":"supporting"}],"derived_kind":"metadata_spine","provenance_mode":"derived_with_handles","normalization_scope":"repo_entry_surfaces","framework_readiness":"neutral","source_repos":["aoa-techniques","Tree-of-Sophia"]},{"id":"AOA-K-0010","name":"tos-zarathustra-route-pack","status":"experimental","summary":"Projects the full canonical Zarathustra prologue-1 route into one bounded KAG-ready bundle of route-local nodes and canonical relations without replacing Tree-of-Sophia authored tree surfaces.","source_class":"tos_text","derived_kind":"node_projection","provenance_mode":"bounded_source_linked","normalization_scope":"route_local_canon","framework_readiness":"neutral","source_repos":["Tree-of-Sophia"]},{"id":"AOA-K-0011","name":"tos-zarathustra-route-retrieval-surface","status":"experimental","summary":"Returns bounded family-level handles for the canonical Zarathustra prologue-1 route bundle so consumers can traverse canonical ToS route surfaces without ranking, source replacement, or routing ownership.","source_class":"tos_text","derived_kind":"retrieval_surface","provenance_mode":"derived_with_handles","normalization_scope":"route_family_handles","framework_readiness":"neutral","source_repos":["Tree-of-Sophia"]}]}
